{"$schema":"http://json-schema.org/draft-07/schema#","$id":"https://agentic-website-studio.local/schemas/m43-source-manifest.schema.json","type":"object","required":["schemaVersion","manifestId","bindings","sourceFiles","creativeAssets","dependencies","buildArtifacts","runtimeAssetBytes"],"properties":{"schemaVersion":{"const":"1.0.0"},"manifestId":{"const":"manifest_wayfinder_m43_full_01"},"projectId":{"type":"string"},"selectedConceptId":{"type":"string"},"bindings":{"type":"object"},"sourceFiles":{"type":"array","minItems":10},"creativeAssets":{"type":"array","minItems":4},"dependencies":{"type":"array"},"buildArtifacts":{"type":"array","minItems":3},"runtimeAssetBytes":{"type":"object"}}}
