{
  "schemaVersion": "1.0.0",
  "manifestId": "manifest_wayfinder_m43_full_01",
  "projectId": "project_wayfinder",
  "selectedConceptId": "concept_three_bearings",
  "bindings": {
    "humanReplayDecision": {
      "id": "decision_wayfinder_m42r_replay_01",
      "path": "docs/wayfinder.m42r-human-replaytest-decision.json",
      "sha256": "ca1f6f01d0f6e26c9032d2756511f14f4ed7b44827502e132c5f5489bad3b8bf"
    },
    "humanExpansionApproval": {
      "id": "approval_wayfinder_m43_expansion_01",
      "path": "docs/wayfinder.m43-human-expansion-approval.json",
      "sha256": "bf20adaceffdaae3de1aa5c20be51f8e76dd697f70f1d98e757b25c4704960f8"
    },
    "expansionContract": {
      "id": "expansion_contract_wayfinder_m43_three_bearings_01",
      "path": "docs/wayfinder.m43-expansion-contract.json",
      "sha256": "7740326702a579d9d6c1119da0ebcb6d2fb52898bff05600722c6a35417d4d2e"
    },
    "m42rSourceManifest": {
      "id": "manifest_wayfinder_m42r_slice_02",
      "path": "docs/wayfinder.m42r-source-manifest.json",
      "sha256": "a9558f3375c742d6edace462e06cc2fb45100cf0f54510e4e41fdd14b1505a0d"
    },
    "m42rReplaytestGate": {
      "id": "replaytest_gate_wayfinder_m42r_slice_02",
      "path": "docs/wayfinder.m42r-human-replaytest-gate.json",
      "sha256": "6808d55f1d68a33eba8913c92ef4b405d6fd9b8074067855f3948c97d6cba3ae"
    },
    "implementationBaseline": "139d3aa335080a856cc9977bb0017913b3fa6375"
  },
  "sourceFiles": [
    {
      "path": "package.json",
      "sha256": "71e377f337445b491979522ce3f0ef7fc5eea9cdcc36dcf5427eb27a5d3079fc"
    },
    {
      "path": "package-lock.json",
      "sha256": "87911c9ec4b37d021ca76040173b4cea2e379b3de7d501815a0e0848e0ef11f5"
    },
    {
      "path": "README.md",
      "sha256": "635fbecdc17887147f3ca2af0dd45c257f04aaae656047e96db8566ab09fdffa"
    },
    {
      "path": "pilots/wayfinder/index.html",
      "sha256": "4e78ace43a4ed6b3ad6de49e88e8e33ec67aa1b2236835418a0716c3c08fbbd8"
    },
    {
      "path": "pilots/wayfinder/src/content.ts",
      "sha256": "3b780c30f250ee57ccbf6e35f6c4f29e7e711a2a8b40200f30f283e2cec55dd1"
    },
    {
      "path": "pilots/wayfinder/src/main.ts",
      "sha256": "cf0cb093941fcae59e94538cf963a5b051b009c8cc41d6c5edad6002158240d8"
    },
    {
      "path": "pilots/wayfinder/src/state-machine.ts",
      "sha256": "f355261041db8d4a3245e43e2607a3d02ce3cf369d211239ea793dfba9378422"
    },
    {
      "path": "pilots/wayfinder/src/styles.css",
      "sha256": "9f185c9bcab7f1c4504feba118d6b277897364ec9851027a4fd7170a970f3dd4"
    },
    {
      "path": "pilots/wayfinder/src/vite-env.d.ts",
      "sha256": "65996936fbb042915f7b74a200fcdde7e410f32a669b1ab9597cfaa4b0faddb5"
    },
    {
      "path": "playwright.wayfinder.config.ts",
      "sha256": "decb3b3b6ace3cd9fd53c3fa02eaefe646afb6e0d6716feead915f87b4226f1f"
    },
    {
      "path": "vite.wayfinder.config.ts",
      "sha256": "08e305faa554c9169b90eaa96d988de45733f1236024078b333196be8eaf6b38"
    },
    {
      "path": "vitest.config.ts",
      "sha256": "c8d34f7bf49e09b4492609a53913974f18b3ee8ad636f2c3d7adfc401d5701d1"
    },
    {
      "path": "tsconfig.json",
      "sha256": "465efdab8dbdcd060838b5628fe6c436cfdea9733802dcf27878d3989b5263f3"
    },
    {
      "path": "src/schema.ts",
      "sha256": "e86dc536628c6c2f7778752cc8e6b4516bf287d0731d779459fc18bab163f7c8"
    },
    {
      "path": "src/m43-validation.ts",
      "sha256": "c2dc82fb3467b97f5a47d6285e2dcd75c065b594cba511e0e2785a4380d71149"
    },
    {
      "path": "src/m43-artifacts.ts",
      "sha256": "e63238392cd2419e5b5ed7aed105bfb8201baf29552f59882ddd254365c1da62"
    },
    {
      "path": "tests/wayfinder-state.test.ts",
      "sha256": "9c246624c839e75236fe3e051a553d30cdca7c42e7ff77e17951a75da6d87c11"
    },
    {
      "path": "tests/wayfinder-contract.test.ts",
      "sha256": "a1786f566a4d69821424e79ff37b31ef3082fa5b3e13451acf83b843cee745fa"
    },
    {
      "path": "tests/wayfinder-e2e/wayfinder.spec.ts",
      "sha256": "cbdad2e52507c7eee671ae8b6c21d914fa4c27a1979643bc8ab2db7b4fc2e3a4"
    },
    {
      "path": "tests/m42r-artifacts.test.ts",
      "sha256": "fc037ab0908fe853045f648a12852d90f8745a0f3ca893413c200476e8c3a011"
    },
    {
      "path": "tests/m43-artifacts.test.ts",
      "sha256": "307a53c8030125b3df4aa35fd2ca3ee78c5017cbcb580a766067c17286267eb8"
    },
    {
      "path": "schemas/m43-human-replaytest-decision.schema.json",
      "sha256": "923b5cfd0bebdbd8e6ddbe0b102b81083aa2f55cba3b6c508ae2eb5ce0f702a2"
    },
    {
      "path": "schemas/m43-human-expansion-approval.schema.json",
      "sha256": "009549dd043b9c9965575b5e80ee3ffae930fd3aa2e9472053f2a6bc9074ba5b"
    },
    {
      "path": "schemas/m43-expansion-contract.schema.json",
      "sha256": "f9753eb8036d93eb38636917ffdfdeaa08235ca70afcd86423a5b2446e32d53b"
    },
    {
      "path": "schemas/m43-source-manifest.schema.json",
      "sha256": "9392449e1d4d1999544ca67070f6a9177470e11614d1b0ac99f1935e92f04c38"
    },
    {
      "path": "schemas/m43-qa-report.schema.json",
      "sha256": "32d91957ea15ead60f6a9e37a1214bcc61fe11db57caad532690fffd1beacc23"
    },
    {
      "path": "schemas/human-expansion-playtest-gate.schema.json",
      "sha256": "bf9a7b880e565a60b92538de496d06030754e58cfe3d87d8ed1ba3291f47cf63"
    },
    {
      "path": "docs/wayfinder.m42r-human-replaytest-decision.json",
      "sha256": "ca1f6f01d0f6e26c9032d2756511f14f4ed7b44827502e132c5f5489bad3b8bf"
    },
    {
      "path": "docs/wayfinder.m43-human-expansion-approval.json",
      "sha256": "bf20adaceffdaae3de1aa5c20be51f8e76dd697f70f1d98e757b25c4704960f8"
    },
    {
      "path": "docs/wayfinder.m43-expansion-contract.json",
      "sha256": "7740326702a579d9d6c1119da0ebcb6d2fb52898bff05600722c6a35417d4d2e"
    }
  ],
  "creativeAssets": [
    {
      "path": "pilots/wayfinder/index.html",
      "sha256": "4e78ace43a4ed6b3ad6de49e88e8e33ec67aa1b2236835418a0716c3c08fbbd8",
      "provenanceClass": "project_native",
      "rightsStatus": "project_owned_original"
    },
    {
      "path": "pilots/wayfinder/src/content.ts",
      "sha256": "3b780c30f250ee57ccbf6e35f6c4f29e7e711a2a8b40200f30f283e2cec55dd1",
      "provenanceClass": "project_native",
      "rightsStatus": "project_owned_original"
    },
    {
      "path": "pilots/wayfinder/src/main.ts",
      "sha256": "cf0cb093941fcae59e94538cf963a5b051b009c8cc41d6c5edad6002158240d8",
      "provenanceClass": "project_native",
      "rightsStatus": "project_owned_original"
    },
    {
      "path": "pilots/wayfinder/src/styles.css",
      "sha256": "9f185c9bcab7f1c4504feba118d6b277897364ec9851027a4fd7170a970f3dd4",
      "provenanceClass": "project_native",
      "rightsStatus": "project_owned_original"
    }
  ],
  "dependencies": [
    {
      "name": "vite",
      "version": "8.2.2",
      "license": "MIT",
      "role": "build_dev_only"
    },
    {
      "name": "playwright",
      "version": "1.62.1",
      "license": "Apache-2.0",
      "role": "test_dev_only"
    },
    {
      "name": "@axe-core/playwright",
      "version": "4.13.0",
      "license": "MPL-2.0",
      "role": "test_dev_only"
    }
  ],
  "buildArtifacts": [
    {
      "path": ".tmp/wayfinder-dist/assets/index-Df1MivaS.css",
      "sha256": "b71b44dd23bc9aa278286f012755b7ab12ebd14a4255d041a44cc46f6eb62a71",
      "bytes": 6949
    },
    {
      "path": ".tmp/wayfinder-dist/assets/index-xq_JYvCM.js",
      "sha256": "5cf62e9b76139d0983ad0dfa7d2b9a986fb9f4ae8a724c4507a0c1782f01af73",
      "bytes": 24177
    },
    {
      "path": ".tmp/wayfinder-dist/index.html",
      "sha256": "9cdc29dda154ef4608aa5233fe00d6bed63a2a7effc8599a3c3a46df05e38db5",
      "bytes": 5855
    }
  ],
  "runtimeAssetBytes": {
    "javascript": 24177,
    "css": 6949,
    "totalAuthoredBuild": 36981
  }
}
